{
  "protocolVersion": 4,
  "correlationId": "11111111-1111-4111-8111-111111111111",
  "ok": true,
  "resultId": "44444444-4444-4444-8444-444444444444",
  "payload": {
    "status": "saved",
    "uploadId": "33333333-3333-4333-8333-333333333333",
    "chunkIndex": 0,
    "evidenceId": "44444444-4444-4444-8444-444444444444",
    "duplicate": false
  }
}
