{
  "protocolVersion": 1,
  "correlationId": "44444444-4444-4444-8444-444444444444",
  "ok": true,
  "resultId": "55555555-5555-4555-8555-555555555555",
  "payload": {
    "ackKind": "snapshot",
    "snapshotId": "66666666-6666-4666-8666-666666666666",
    "chunkIndex": 1,
    "chunkCursor": 0
  }
}
