{
  "protocolVersion": 2,
  "correlationId": "33333333-3333-4333-8333-333333333333",
  "ok": true,
  "payload": {
    "templates": [
      {
        "id": "55555555-5555-4555-8555-555555555555",
        "name": "Template",
        "fieldCount": 0
      },
      {
        "id": "55555555-5555-4555-8555-555555555555",
        "name": "Template",
        "fieldCount": 0
      },
      {
        "id": "55555555-5555-4555-8555-555555555555",
        "name": "Template",
        "fieldCount": 0
      },
      {
        "id": "55555555-5555-4555-8555-555555555555",
        "name": "Template",
        "fieldCount": 0
      },
      {
        "id": "55555555-5555-4555-8555-555555555555",
        "name": "Template",
        "fieldCount": 0
      },
      {
        "id": "55555555-5555-4555-8555-555555555555",
        "name": "Template",
        "fieldCount": 0
      },
      {
        "id": "55555555-5555-4555-8555-555555555555",
        "name": "Template",
        "fieldCount": 0
      },
      {
        "id": "55555555-5555-4555-8555-555555555555",
        "name": "Template",
        "fieldCount": 0
      },
      {
        "id": "55555555-5555-4555-8555-555555555555",
        "name": "Template",
        "fieldCount": 0
      },
      {
        "id": "55555555-5555-4555-8555-555555555555",
        "name": "Template",
        "fieldCount": 0
      },
      {
        "id": "55555555-5555-4555-8555-555555555555",
        "name": "Template",
        "fieldCount": 0
      },
      {
        "id": "55555555-5555-4555-8555-555555555555",
        "name": "Template",
        "fieldCount": 0
      },
      {
        "id": "55555555-5555-4555-8555-555555555555",
        "name": "Template",
        "fieldCount": 0
      },
      {
        "id": "55555555-5555-4555-8555-555555555555",
        "name": "Template",
        "fieldCount": 0
      },
      {
        "id": "55555555-5555-4555-8555-555555555555",
        "name": "Template",
        "fieldCount": 0
      },
      {
        "id": "55555555-5555-4555-8555-555555555555",
        "name": "Template",
        "fieldCount": 0
      },
      {
        "id": "55555555-5555-4555-8555-555555555555",
        "name": "Template",
        "fieldCount": 0
      },
      {
        "id": "55555555-5555-4555-8555-555555555555",
        "name": "Template",
        "fieldCount": 0
      },
      {
        "id": "55555555-5555-4555-8555-555555555555",
        "name": "Template",
        "fieldCount": 0
      },
      {
        "id": "55555555-5555-4555-8555-555555555555",
        "name": "Template",
        "fieldCount": 0
      },
      {
        "id": "55555555-5555-4555-8555-555555555555",
        "name": "Template",
        "fieldCount": 0
      },
      {
        "id": "55555555-5555-4555-8555-555555555555",
        "name": "Template",
        "fieldCount": 0
      },
      {
        "id": "55555555-5555-4555-8555-555555555555",
        "name": "Template",
        "fieldCount": 0
      },
      {
        "id": "55555555-5555-4555-8555-555555555555",
        "name": "Template",
        "fieldCount": 0
      },
      {
        "id": "55555555-5555-4555-8555-555555555555",
        "name": "Template",
        "fieldCount": 0
      },
      {
        "id": "55555555-5555-4555-8555-555555555555",
        "name": "Template",
        "fieldCount": 0
      }
    ],
    "activeTemplate": null,
    "profile": {
      "values": {},
      "family": [],
      "custom": []
    },
    "profileRevision": 0
  }
}
